[
  {
    "id": "evidence-omega3-001",
    "supplement": "오메가3",
    "ingredient_aliases": [
      "EPA",
      "DHA",
      "fish oil"
    ],
    "clinical_question": "고중성지방혈증 환자에서 고용량 오메가3가 도움이 되는가?",
    "population": "고중성지방혈증 성인",
    "conditions": [
      "고중성지방혈증",
      "고지혈증"
    ],
    "medications": [
      "스타틴"
    ],
    "interaction_risk": "moderate",
    "interaction_summary": "항응고제 또는 항혈소판제와 병용 시 출혈 위험 증가 가능성 고려.",
    "evidence_level": "moderate",
    "effect_size": {
      "metric": "triglyceride_change",
      "value": -20,
      "unit": "%",
      "comparison": "baseline"
    },
    "dosage_range": {
      "min": 2,
      "max": 4,
      "unit": "g/day",
      "schedule": "daily"
    },
    "safety_flags": [
      "고용량 주의",
      "출혈 위험 확인"
    ],
    "summary": "중성지방 감소 근거는 비교적 있으나 심혈관 사건 감소는 제형과 대상군에 따라 다름.",
    "counseling_points": [
      "제형 확인",
      "항응고제 병용 여부 확인",
      "목표는 중성지방 감소인지 명확화"
    ],
    "uncertainty_notes": [
      "일반 시판 제품과 처방 제형 근거를 구분해야 함"
    ],
    "source_title": "REDUCE-IT and related reviews",
    "source_type": "review",
    "citation": "Bhatt DL et al. N Engl J Med. 2019.",
    "updated_at": "2026-03-08"
  },
  {
    "id": "evidence-coq10-001",
    "supplement": "CoQ10",
    "ingredient_aliases": [
      "코엔자임Q10",
      "ubiquinone"
    ],
    "clinical_question": "스타틴 복용 환자에서 CoQ10이 근육통 완화에 도움이 되는가?",
    "population": "스타틴 복용 성인",
    "conditions": [
      "고지혈증"
    ],
    "medications": [
      "스타틴"
    ],
    "interaction_risk": "low",
    "interaction_summary": "중대한 상호작용은 드물지만 기대 효과는 제한적일 수 있음.",
    "evidence_level": "low",
    "effect_size": {
      "metric": "myalgia_improvement",
      "value": 1,
      "unit": "qualitative",
      "comparison": "possible benefit"
    },
    "dosage_range": {
      "min": 100,
      "max": 300,
      "unit": "mg/day",
      "schedule": "daily"
    },
    "safety_flags": [
      "기대치 조절 필요"
    ],
    "summary": "일부 연구에서 근육통 개선 가능성이 보고되나 일관된 결론은 부족.",
    "counseling_points": [
      "심혈관 예방 효과와 근육통 완화 근거를 구분",
      "효과 없으면 중단 기준 정하기"
    ],
    "uncertainty_notes": [
      "연구 규모가 작고 결과가 일관되지 않음"
    ],
    "source_title": "CoQ10 for statin-associated muscle symptoms",
    "source_type": "review",
    "citation": "Systematic review, mixed-quality trials.",
    "updated_at": "2026-03-08"
  },
  {
    "id": "evidence-chromium-001",
    "supplement": "크롬",
    "ingredient_aliases": [
      "chromium picolinate"
    ],
    "clinical_question": "당뇨 환자에서 크롬이 혈당 조절에 도움이 되는가?",
    "population": "제2형 당뇨병 성인",
    "conditions": [
      "당뇨"
    ],
    "medications": [
      "메트포르민"
    ],
    "interaction_risk": "unknown",
    "interaction_summary": "메트포르민과 중대한 상호작용은 뚜렷하지 않지만 고용량 장기 안전성은 제한적.",
    "evidence_level": "low",
    "effect_size": {
      "metric": "hba1c_change",
      "value": -0.3,
      "unit": "%",
      "comparison": "vs placebo"
    },
    "dosage_range": {
      "min": 200,
      "max": 1000,
      "unit": "mcg/day",
      "schedule": "daily"
    },
    "safety_flags": [
      "고용량 장기 복용 데이터 부족"
    ],
    "summary": "일부 RCT에서 HbA1c 소폭 감소 가능성이 있으나 효과 크기는 제한적.",
    "counseling_points": [
      "생활습관 개선 대비 효과 크기 설명",
      "즉시 약 대체용으로 설명하지 않기"
    ],
    "uncertainty_notes": [
      "장기 연구 부족"
    ],
    "source_title": "Chromium supplementation in type 2 diabetes",
    "source_type": "meta_analysis",
    "citation": "Meta-analysis of small RCTs.",
    "updated_at": "2026-03-08"
  },
  {
    "id": "evidence-magnesium-001",
    "supplement": "마그네슘",
    "ingredient_aliases": [
      "magnesium"
    ],
    "clinical_question": "신질환 환자에서 마그네슘 보충이 안전한가?",
    "population": "만성 신질환 성인",
    "conditions": [
      "만성 신질환"
    ],
    "medications": [],
    "interaction_risk": "moderate",
    "interaction_summary": "신기능 저하 환자에서는 축적 위험 때문에 보충 전 용량과 적응증 확인이 필요.",
    "evidence_level": "low",
    "effect_size": {
      "metric": "symptom_relief",
      "value": 1,
      "unit": "qualitative",
      "comparison": "possible benefit"
    },
    "dosage_range": {
      "min": 200,
      "max": 350,
      "unit": "mg/day",
      "schedule": "daily"
    },
    "safety_flags": [
      "신기능 저하 시 축적 위험",
      "설사 등 위장관 부작용"
    ],
    "summary": "일반 성인에서는 비교적 안전하지만 CKD에서는 보수적으로 접근해야 함.",
    "counseling_points": [
      "eGFR 확인",
      "완하제/제산제 중복 확인"
    ],
    "uncertainty_notes": [
      "질환 중증도에 따른 데이터 제한"
    ],
    "source_title": "Magnesium use in CKD reviews",
    "source_type": "review",
    "citation": "Review articles on magnesium and CKD.",
    "updated_at": "2026-03-08"
  },
  {
    "id": "evidence-vitamind-001",
    "supplement": "비타민D",
    "ingredient_aliases": [
      "vitamin d",
      "d3",
      "콜레칼시페롤"
    ],
    "clinical_question": "고칼슘혈증 병력이 있는 환자에서 비타민D 보충은 안전한가?",
    "population": "고칼슘혈증 병력 성인",
    "conditions": [
      "고칼슘혈증"
    ],
    "medications": [],
    "interaction_risk": "high",
    "interaction_summary": "고칼슘혈증 병력이 있으면 비타민D 추가 보충 전 혈중 칼슘과 25(OH)D 확인이 우선.",
    "evidence_level": "moderate",
    "effect_size": {
      "metric": "vitamin_d_repletion",
      "value": 1,
      "unit": "qualitative",
      "comparison": "effective if deficient"
    },
    "dosage_range": {
      "min": 800,
      "max": 2000,
      "unit": "IU/day",
      "schedule": "daily"
    },
    "safety_flags": [
      "고칼슘혈증 재발 가능성",
      "중복 복용 확인"
    ],
    "summary": "결핍 교정에는 도움이 되지만 고칼슘혈증 병력 환자에서는 검사 기반 접근이 필요.",
    "counseling_points": [
      "칼슘제/멀티비타민 중복 확인",
      "검사 전 고용량 시작 피하기"
    ],
    "uncertainty_notes": [
      "기저 원인에 따라 안전성 차이"
    ],
    "source_title": "Vitamin D safety guidance",
    "source_type": "guideline",
    "citation": "Guideline-style safety summaries.",
    "updated_at": "2026-03-08"
  },
  {
    "id": "evidence-probiotic-001",
    "supplement": "프로바이오틱스",
    "ingredient_aliases": [
      "유산균",
      "probiotics"
    ],
    "clinical_question": "면역저하 환자에서 프로바이오틱스는 안전한가?",
    "population": "면역저하 성인",
    "conditions": [
      "면역저하"
    ],
    "medications": [
      "면역억제제"
    ],
    "interaction_risk": "moderate",
    "interaction_summary": "대부분 안전하지만 중증 면역저하 상태에서는 균혈증 등 드문 합병증 가능성 고려.",
    "evidence_level": "low",
    "effect_size": {
      "metric": "gi_symptom_relief",
      "value": 1,
      "unit": "qualitative",
      "comparison": "possible benefit"
    },
    "dosage_range": {
      "min": 1,
      "max": 10,
      "unit": "billion CFU/day",
      "schedule": "daily"
    },
    "safety_flags": [
      "중증 면역저하 시 보수적 접근"
    ],
    "summary": "일반인에서는 비교적 안전하지만 면역저하 환자에서는 개별 판단 필요.",
    "counseling_points": [
      "면역저하 정도 확인",
      "발열/중심정맥관 여부 확인"
    ],
    "uncertainty_notes": [
      "중증군 데이터가 제한적"
    ],
    "source_title": "Probiotics safety in immunocompromised hosts",
    "source_type": "review",
    "citation": "Review on rare invasive infections.",
    "updated_at": "2026-03-08"
  },
  {
    "id": "evidence-selenium-001",
    "supplement": "셀레늄",
    "ingredient_aliases": [
      "selenium"
    ],
    "clinical_question": "갑상선 질환 환자에서 셀레늄이 도움이 되는가?",
    "population": "갑상선 질환 성인",
    "conditions": [
      "갑상선 질환"
    ],
    "medications": [],
    "interaction_risk": "unknown",
    "interaction_summary": "일반적 상호작용은 크지 않지만 장기 고용량 보충은 독성 위험이 있음.",
    "evidence_level": "low",
    "effect_size": {
      "metric": "antibody_change",
      "value": -1,
      "unit": "qualitative",
      "comparison": "possible reduction"
    },
    "dosage_range": {
      "min": 100,
      "max": 200,
      "unit": "mcg/day",
      "schedule": "daily"
    },
    "safety_flags": [
      "장기 고용량 독성 주의"
    ],
    "summary": "특정 갑상선 질환에서 항체 감소 가능성이 보고되지만 임상적 이득은 불확실.",
    "counseling_points": [
      "요오드 상태와 구분해서 설명",
      "장기 복용 전 중단 기준 정하기"
    ],
    "uncertainty_notes": [
      "임상 증상 개선과 직접 연결은 약함"
    ],
    "source_title": "Selenium and thyroid disease reviews",
    "source_type": "review",
    "citation": "Review of autoimmune thyroiditis studies.",
    "updated_at": "2026-03-08"
  },
  {
    "id": "evidence-lutein-001",
    "supplement": "루테인",
    "ingredient_aliases": [
      "lutein",
      "지아잔틴"
    ],
    "clinical_question": "눈 건강 관리를 위해 루테인이 도움이 되는가?",
    "population": "중장년 성인",
    "conditions": [
      "눈 건강"
    ],
    "medications": [],
    "interaction_risk": "none_known",
    "interaction_summary": "중대한 약물 상호작용은 잘 알려져 있지 않음.",
    "evidence_level": "moderate",
    "effect_size": {
      "metric": "macular_pigment_support",
      "value": 1,
      "unit": "qualitative",
      "comparison": "supportive"
    },
    "dosage_range": {
      "min": 10,
      "max": 20,
      "unit": "mg/day",
      "schedule": "daily"
    },
    "safety_flags": [
      "효과 기대치 과도하게 설명하지 않기"
    ],
    "summary": "황반색소 유지와 관련된 보조적 근거가 있으나 즉각적인 시력 개선 효과로 설명하긴 어려움.",
    "counseling_points": [
      "생활습관과 병행 설명",
      "증상 치료제처럼 설명하지 않기"
    ],
    "uncertainty_notes": [
      "기저 안질환 유무에 따라 체감 차이 큼"
    ],
    "source_title": "AREDS-related eye nutrition reviews",
    "source_type": "review",
    "citation": "Eye nutrition review articles.",
    "updated_at": "2026-03-08"
  },
  {
    "id": "evidence-melatonin-001",
    "supplement": "멜라토닌",
    "ingredient_aliases": [
      "melatonin"
    ],
    "clinical_question": "수면 보조로 멜라토닌이 도움이 되는가?",
    "population": "불면 증상 성인",
    "conditions": [
      "수면장애"
    ],
    "medications": [],
    "interaction_risk": "moderate",
    "interaction_summary": "진정제나 수면제와 병용 시 과도한 졸림 가능성을 확인해야 함.",
    "evidence_level": "moderate",
    "effect_size": {
      "metric": "sleep_latency_change",
      "value": -10,
      "unit": "min",
      "comparison": "vs placebo"
    },
    "dosage_range": {
      "min": 1,
      "max": 5,
      "unit": "mg/day",
      "schedule": "bedtime"
    },
    "safety_flags": [
      "주간 졸림 가능성"
    ],
    "summary": "수면 잠들기까지 걸리는 시간을 소폭 줄일 수 있으나 효과 크기는 크지 않음.",
    "counseling_points": [
      "수면위생과 같이 설명",
      "장기 복용보다 단기 사용 목적 확인"
    ],
    "uncertainty_notes": [
      "제품 간 함량 편차 가능성"
    ],